id_planeador;Cliente;Gestor;DC;PR;PD;FB;MT;OC;CE;Descripcion;Fecha_solicitud;Prioridad;Dificultad;Progreso;FL;Fecha_Estimada;Fecha_Entrega;Observaciones;Revision;Estado;Referencia
0117;0042;JSE;Y;Y;N;N;N;N;N;"Repuestos Cono TC, Resorte Ref. TC 360 4005 Cant. 40, Housing para resortes Ref. TC 360 4006 Cant. 24""";22/06/2012 12:00;B;5;100;N;0000-00-00 00:00:00;26/06/2012 12:00;Consultar los precios con Fredy;;A;D-3368-12
0118;0041;DSC;N;Y;Y;Y;N;N;N;Tornillo transportador para manejo de carbon o madera, diametro de 200 mm x 1 m;25/06/2012 12:00;M;4;10;N;0000-00-00 00:00:00;28/06/2012 12:00;El cliente no responde a las aclaraciones solicitadas.;;C;
0119;0043;JSE;Y;Y;N;N;N;N;N;"Raspadores secundarios para bandas transportadoras de ancho: 90"", 60"", 24"", 18"".""";23/06/2012 12:00;M;3;100;N;25/06/2012 12:00;27/06/2012 12:00;"A espera de respuesta por parte de American Eagle para poder cotizar. Enviar cotización al correo fyd@fyd.com.co""";;A;
0120;0017;FAP;Y;Y;N;Y;Y;N;N;Elevadores de cangilones para Harina.;25/06/2012 12:00;A;6;10;N;28/06/2012 12:00;27/06/2012 12:00;;;P;
0121;0029;JSE;N;Y;N;Y;N;N;N;"Bandas trasnportadoras: 42"" x 52 m @ 16º - 500 TPH x 40 HP 30"" x 20 m @ 16º - 300 TPH x 20 HP, Ambas con pasarela de 800 mm, ANL 250 """;25/06/2012 12:00;MA;4;80;N;26/06/2012 12:00;27/06/2012 12:00;"Enviar oferta a comercial@colmecol.com T: 7587489, C: 3144619416, Sobrepasa el tiempo de envio.""";;C;
0122;0042;JSE;Y;Y;N;N;N;N;N;"Repuestos para molino CURTAIN LINER PART No. APS4054.3-1, Cant. 30, WEDGE (RH) PART N° AP4034.2.1.-1, Cant. 4, WEDGE (LH) PART N° AP4034.2.1-2, Cant. 4""";26/06/2012 12:00;MA;3;100;N;28/06/2012 12:00;27/06/2012 12:00;A espera de aprobación de Fredy;;A;D-3374-12
0123;0074;DSC;Y;Y;Y;Y;N;N;N;Mesa de rodillos de 2 m x 0,5 m;28/06/2012 12:00;B;3;100;N;0000-00-00 00:00:00;28/06/2012 12:00;;;A;
0124;0064;JSE;Y;Y;N;Y;N;N;N;"24 rodillos de diámetro 72 mm x 274 mm, 6 rodillos de diámetro 72 mm x 540 mm""";29/06/2012 12:00;A;2;100;N;0000-00-00 00:00:00;29/06/2012 12:00;;;A;D-3376-12
0125;0073;JSE;Y;Y;N;N;N;N;N;"Staker para tornillo transportador de 124 mm de diametro, 2600 mm de longitud, paso de 300 mm, 200 mm de punta coninca, puntas de eje en SAE 1045 1 1-2"" """;29/06/2012 12:00;A;3;100;N;0000-00-00 00:00:00;30/06/2012 12:00;Basarse en el presupuesto realizado para P.109;;A;D-3377-12
0126;0075;JSE;Y;N;N;N;N;N;N;Realizar informe referente al analisis realizado a la fundición de las placas de impacto para el molino MIS-40.;30/06/2012 12:00;M;2;100;N;03/07/2012 12:00;03/07/2012 12:00;Se envia informe de uso interno para tomar una desición respecto a la garantia de las placas de impacto.;;A;
0127;0049;JSE;Y;Y;N;N;N;N;N;Cotización de rejillas y soportes para 22 m, tomando de referencia las vendidas con la cotización D-3074B-12;30/06/2012 12:00;M;2;100;N;0000-00-00 00:00:00;03/07/2012 12:00;;;A;D-3380-12
0128;0081;JSE;N;Y;N;Y;N;N;N;"Rodillos de 25 cm de largo con cuadrante de 1-2"" eje de 7-8"" diametro de 8 cm""";03/07/2012 12:00;B;2;50;N;0000-00-00 00:00:00;05/07/2012 12:00;;;P;
0129;0019;FAP;Y;Y;N;Y;N;N;N;Tolva según planos, con lamina antidesgaste.;03/07/2012 12:00;A;2;80;N;0000-00-00 00:00:00;05/07/2012 12:00;;;P;
0130;0064;JSE;Y;Y;N;Y;N;N;N;"Rodillo con diámetro exterior de 73 mm x 182 mm, eje de 7-8"" x 212 mm, Cantidad 3, 6Rodillo diametro 73 mm x 470 mm, eje 7-8"" x 510 mm con puntas estandar, Cantidad 6""";03/07/2012 12:00;M;2;100;Y;04/07/2012 12:00;06/07/2012 12:00;;;A;D-3385-12
0131;0031;DSC;N;Y;Y;Y;N;N;N;"Bandas trasnportadoras, de apilamiento, cantidad 3, longitud 18 m, cinta de 24"", velocidad de 1,5 m-s, con reductores Dodge.""";05/07/2012 12:00;M;5;40;N;09/07/2012 12:00;08/07/2012 12:00;;;P;
0132;0078;JSE;Y;Y;N;N;N;N;N;Cauchos para rodilleria de diametro externo 89, diametro interno de 60 y ancho de 38 mm;06/07/2012 12:00;B;2;100;N;0000-00-00 00:00:00;06/07/2012 12:00;;;A;D-3388-12
0133;0003;FAP;Y;N;Y;N;N;N;N;Calculo de potencias para bandas transportadoras del proyecto --;06/07/2012 12:00;MA;5;100;N;06/07/2012 12:00;06/07/2012 12:00;;;A;
