id_planeador;Cliente;Gestor;DC;PR;PD;FB;MT;OC;CE;Descripcion;Fecha_solicitud;Prioridad;Dificultad;Progreso;FL;Fecha_Estimada;Fecha_Entrega;Observaciones;Revision;Estado;Referencia
0001;0048;DSC;N;Y;Y;Y;N;N;N;--;01/11/2011 12:00;M;7;100;N;0000-00-00 00:00:00;11/11/2011 12:00;;;A;
0002;0038;NGM;Y;Y;Y;Y;N;N;N;--;01/11/2011 12:00;M;6;100;N;0000-00-00 00:00:00;10/12/2011 12:00;;;A;D-2173-11
0003;0053;DSC;N;Y;Y;N;N;N;N;--;01/12/2011 12:00;M;4;100;N;0000-00-00 00:00:00;14/12/2011 12:00;;;A;
0004;0086;NGM;N;Y;Y;N;N;N;N;--;01/12/2011 12:00;M;5;25;N;0000-00-00 00:00:00;03/12/2011 12:00;;;R;
0005;0045;DSC;N;Y;Y;Y;N;N;N;--;15/12/2011 12:00;M;3;100;N;0000-00-00 00:00:00;20/12/2011 12:00;;;A;D-2992-11
0006;0025;AGM;Y;Y;Y;Y;Y;N;Y;Banda alimentadora para equipos THOR;22/12/2011 12:00;MA;6;100;N;0000-00-00 00:00:00;10/02/2012 12:00;;;A;D-2995-11
0007;0035;FAP;N;Y;N;N;N;N;N;Estaciones de carga, impacto, retorno, auto alineantes.;21/12/2011 12:00;B;2;100;N;0000-00-00 00:00:00;22/12/2011 12:00;;;A;D-2991-11
0008;0070;JMR;N;N;Y;N;N;N;N;Calculo de potencias para bandas transportadoras del proyecto Pacific Iron;23/11/2011 12:00;MA;6;100;Y;24/12/2011 12:00;24/12/2011 12:00;Se hacen dos nuevas revisiones a las potencias debido a cambios realizados por el cliente.;;A;
0009;0035;FAP;N;Y;N;N;N;N;N;Estaciones de carga, impacto, retorno, auto alineantes.;26/12/2011 12:00;MB;2;10;N;0000-00-00 00:00:00;28/12/2011 12:00;;;C;
0010;0020;FAP;N;N;Y;N;N;N;N;Calculo de potencias para banda transportadora. 70 tph, 30 m.;27/12/2011 12:00;M;3;100;N;0000-00-00 00:00:00;27/12/2011 12:00;;;C;
0011;0001;FAP;N;Y;Y;Y;N;N;N;Banda transportadora 1750 m;26/12/2011 12:00;M;2;10;N;0000-00-00 00:00:00;28/12/2011 12:00;;;C;
0013;0080;FAP;N;Y;Y;Y;Y;N;N;Bandas transportadoras de acuerdo a especificaciones, tolvas de transferencia, y chutes de sobretamaños.;28/12/2011 12:00;MA;7;100;N;0000-00-00 00:00:00;02/01/2012 12:00;;;A;D-3002-12
0014;0083;FAP;N;Y;N;N;N;N;N;Rodillos CEMA B.;30/12/2011 12:00;B;2;100;N;0000-00-00 00:00:00;03/01/2012 12:00;;;A;D-3004-12
0015;0089;DSC;N;Y;N;Y;Y;N;N;Secador solar de acuerdo a indicaciones de planos.;02/01/2012 12:00;M;4;100;N;0000-00-00 00:00:00;13/01/2012 12:00;;;A;D-3012-12
0016;0047;DSC;N;Y;Y;Y;N;N;N;Fabricación de cama de rodillos para muebles.;06/01/2012 12:00;B;4;100;N;0000-00-00 00:00:00;09/01/2012 12:00;Se transfiere el presupuesto al gestor comercial;;C;D-3025-12
0017;0022;AGM;Y;Y;N;N;Y;N;N;Prestación de servicios en mantenimiento de estaciones, raspadores primarios y secundarios.;06/01/2012 12:00;MA;10;100;N;0000-00-00 00:00:00;25/01/2012 12:00;Solo se envión información de personal y financiera para la creación del consorcio.;R4;A;D-3038-12
0018;0023;AGM;Y;Y;N;N;N;N;N;Prestación de servicios de ingeniería, en consorcio con empresa.;18/01/2012 12:00;A;8;100;N;0000-00-00 00:00:00;20/01/2012 12:00;Solo se envión información de personal y financiera para la creación del consorcio.;;A;
0019;0059;FAP;N;Y;N;N;N;N;N;Zaranda 5' x 16' x 3 deck;19/01/2012 12:00;B;2;10;N;0000-00-00 00:00:00;21/01/2012 12:00;Se transfiere el caso al gestor comercial;;C;
0020;0010;AGM;N;Y;Y;Y;N;N;N;Equipos en acero inoxidable, Zaranda 3' x 6' x 2 deck, tornillo transportador 2 TPH x 2 m, tornillo transportador 2 TPH x 6 m.;20/01/2012 12:00;M;6;100;N;0000-00-00 00:00:00;31/01/2012 12:00;;R1;A;D-3050-12
0021;0055;DSC;N;Y;N;Y;N;N;Y;--;20/01/2012 12:00;M;4;45;N;0000-00-00 00:00:00;21/01/2012 12:00;;;C;
0022;0059;AGM;N;Y;N;N;N;N;N;Zaranda 4' x 14' horizontal y zaranda 5' x 16' horizontal;23/01/2012 12:00;M;3;100;N;0000-00-00 00:00:00;23/01/2012 12:00;;;A;D-3021-12
0023;0034;AGM;N;Y;N;Y;N;N;N;Bujes bipartidos para centrador de tornillos en SAE-64;25/01/2012 12:00;B;2;100;N;0000-00-00 00:00:00;30/01/2012 12:00;;;A;D-3049-12
0024;0060;FAP;N;Y;N;N;N;N;N;Mallas para noria;30/01/2012 12:00;M;3;100;N;0000-00-00 00:00:00;03/02/2012 12:00;El cliente desconoce las dimensiones exactas de las mallas, por lo tanto quedamos a espera de su respuesta en el tema.;;A;D-3061-12
0025;0090;FAP;N;Y;N;N;N;N;N;Cauchos linatex de distintos espesores;03/02/2012 12:00;A;2;100;N;0000-00-00 00:00:00;03/02/2012 12:00;;;A;D-3058-12
0026;0026;FAP;N;Y;Y;Y;N;N;N;Tornillo transportador horizontal de 1,5 m ;03/02/2012 12:00;B;4;100;N;0000-00-00 00:00:00;04/02/2012 12:00;;;A;D-3068-12
0027;0025;AGM;Y;Y;N;N;N;N;N;Repuestos para equipo THOR;03/02/2012 12:00;MA;2;100;N;0000-00-00 00:00:00;03/02/2012 12:00;;;A;
0028;0018;FAP;Y;Y;N;Y;Y;N;N;Banda transportadora con puente con doble pasarela;04/02/2012 12:00;MA;7;100;Y;05/03/2012 12:00;03/03/2012 12:00;Se ha usado un factor de servicio de 1,5 para el calculo del peso de la estructura. Finalmente se ha enviado la versión final a Fredy para su revisión y envió.;R2;A;
0029;0064;DSC;N;Y;Y;Y;Y;N;N;Elevadores de cangilones para proyecto de Nicaragua.;04/02/2012 12:00;M;5;15;N;0000-00-00 00:00:00;06/02/2012 12:00;Se le solicitó al cliente completar la información de dicho proyecto, sin obtener respuesta alguna.;;C;
0030;0001;FAP;N;Y;Y;Y;N;N;N;Banda transportadora 40 m;06/02/2012 12:00;M;4;100;N;0000-00-00 00:00:00;21/02/2012 12:00;;;A;D-4532-12
0031;0012;FAP;N;Y;N;Y;N;N;N;"Stacker para tornillo transportador Ø 5"" de dimensiones especificadas en plano.""";04/02/2012 12:00;M;3;100;N;0000-00-00 00:00:00;07/02/2012 12:00;Se realiza actualización de la cotización para fines de compra.;;A;D-3069-12
0032;0033;DSC;N;Y;N;Y;N;N;N;Distintos tornillos transportadores de acuerdo a especificaciones de clientes.;10/02/2012 12:00;B;3;10;N;12/03/2012 12:00;12/02/2012 12:00;La información suministrada por el cliente es confusa e incompleta.;;C;
0033;0062;FAP;N;Y;N;N;N;N;N;Componentes para banda transportadora;15/02/2012 12:00;B;2;10;N;0000-00-00 00:00:00;17/02/2012 12:00;La solicitud de cotización correspondía a un proyecto manejado directamente con el cliente.;;C;
0034;0086;DSC;N;Y;N;Y;N;N;N;Cotizar de acuerdo a planos suministrados el valor por tramo para distintos tipos de tornillos;18/02/2012 12:00;MA;6;50;Y;22/02/2012 12:00;22/02/2012 12:00;Solo fue posible cotizar los tipos estándar debido a que los planos debían ser entregados en la fecha limite.;R2;A;
0035;0066;AGM;N;Y;N;Y;N;N;N;"Banda transportadora horizontal de 24"" x 18 m, banda horizontal de 36"" x 12 m""";20/02/2012 12:00;A;4;100;N;0000-00-00 00:00:00;21/02/2012 12:00;;;A;
0036;0056;AGM;N;Y;N;Y;N;N;N;"Tornillo con D = 400 mm, Tipo = canoa, L = 2 m""";24/02/2012 12:00;M;3;25;N;0000-00-00 00:00:00;26/02/2012 12:00;Superamos el tiempo limite para entrega de cotización.;;C;
0037;0076;FAP;N;Y;N;Y;N;N;N;"Tornillo con L = 2 m, Q = 50 kg-min, densidad = 2.6 kg-dm³""";28/02/2012 12:00;M;3;20;N;0000-00-00 00:00:00;03/03/2012 12:00;;;C;
0038;0032;DSC;N;Y;N;Y;Y;Y;Y;2 Tornillos transportadores, 2 bandas subterráneas, 1 elevador de cangilones. Para circuito cerrado de 2,5 T-h;29/02/2012 12:00;A;6;40;N;08/03/2012 12:00;03/03/2012 12:00;"Los dos tornillos transportadores son reemplazados por un elevador de cangilones y una compuerta neumática de alimentación. El cliente no respondió a las inquietudes respecto a la distribución de la planta.""";;C;
0039;0014;FAP;N;Y;N;Y;Y;N;N;2 tambores secadores de acuerdo a especificaciones del manual.;02/03/2012 12:00;A;10;100;N;09/04/2012 12:00;10/04/2012 12:00;Tener muy en cuenta que el material a manejar es caliente, por lo tanto, no puede girar sobre ruedas, debe estar sobre laminas roladas.;R3;A;
0040;0021;FAP;N;Y;N;Y;Y;N;Y;3 bandas transportadoras con longitud de 15 m y ?H 6 m ó Una sola banda con cambios de material.;02/03/2012 12:00;M;5;100;N;0000-00-00 00:00:00;14/03/2012 12:00;"A espera de confirmación de datos de operación por parte del cliente. Es necesario cotizar el montaje y dar un listado de precios al cliente""";;A;D-4000-12
0041;0087;DSC;N;N;Y;N;N;N;N;Calculo de potencias para banda transportadora.;12/03/2012 12:00;B;4;100;N;12/03/2012 12:00;12/03/2012 12:00;;;A;
0042;0022;AGM;Y;Y;N;N;Y;N;N;Segunda etapa del proceso de licitación.;12/03/2012 12:00;MA;9;100;Y;15/03/2012 12:00;15/03/2012 12:00;Responder todas las preguntas asociadas al tema.;;A;
0043;0011;AGM;N;Y;Y;Y;N;N;N;"Tolva con capacidad de 2 a 3 m³. Q de 20 TPH y tamaño de grano 14"" de entrada salida 2""";12/03/2012 12:00;M;5;45;N;12/03/2012 12:00;15/03/2012 12:00;Pedir información a fredy referente a los trituradores;;C;
0044;0055;DSC;N;Y;Y;Y;Y;N;N;"Tornillo transportador Q 500 kg-h, 1,7 m. Banda transportadora 13 m, 800 mm, Q 2 tph.""";10/03/2012 12:00;B;4;100;N;14/03/2012 12:00;16/03/2012 12:00;;;A;
0045;0028;DSC;N;Y;Y;Y;Y;N;N;Doble mesa vertical con doble rodillo, retráctil para facilitar ;17/03/2012 12:00;A;6;100;N;21/03/2012 12:00;26/03/2012 12:00;"Ya existen antecedentes de cotización, para CAV se cotizó algo similar. Se realizan planos de prediseño y cotización""";;A;D-3193-12
0046;0075;FAP;N;Y;N;Y;N;N;N;"Pantallas de impacto para Molino impactor MIS-40. Pantallas antidesgaste laterales y sistemas tensores.""";17/03/2012 12:00;MA;7;100;N;21/03/2012 12:00;21/03/2012 12:00;"Se cotizará teniendo en cuenta información de ventas anteriores. Además de los planos para las pantallas de impacto. Se agrega el requerimiento de las pantallas laterales antidesgaste y los sistemas tensores. El cliente es referenciado como Napoleón Gutiérrez""";R2;A;D-3176-12
0047;0082;FAP;N;Y;N;Y;N;N;N;Precios de rodilleria y tambores de cabeza;21/03/2012 12:00;M;4;100;Y;21/03/2012 12:00;21/03/2012 12:00;Todos los precios deben ser nacionales;R2;A;
0048;0004;DSC;N;N;Y;N;N;N;N;"Calculo y comparación de capacidades para bandas transportadora de 24"" y 18"" con longitud de 11 m""";14/03/2012 12:00;M;4;100;N;14/03/2012 12:00;14/03/2012 12:00;"Se envía la comparación para sustentar la selección del equipo de 24"". Se agrega solicitud de precios de motores de 5HP""";;A;
0049;0089;DSC;N;Y;N;Y;Y;N;N;Quemador para secador solar;21/03/2012 12:00;B;5;10;N;23/03/2012 12:00;23/03/2012 12:00;"Tener en cuenta la cotización anterior para U.N y aumentar los precios. El cliente no tiene clara la compra del equipo y por tal motivo se cancela.""";;C;
0050;0016;DSC;N;N;Y;N;N;N;N;"Calculo para banda de 24"" x 160 m x 0° Y Banda 24"" x 10 m x 0° Ambas con capacidad de 50 TPH""";22/03/2012 12:00;B;4;100;N;23/03/2012 12:00;26/03/2012 12:00;;;A;
0051;0022;AGM;Y;Y;N;N;Y;N;N;Tercera etapa de aclaraciones en el proceso de mantenimiento de componentes de banda;24/03/2012 12:00;MA;7;100;Y;28/03/2012 12:00;28/03/2012 12:00;Responder a las inquietudes presentadas por el Cerrejón;;A;
0052;0090;DSC;N;Y;N;Y;N;N;N;"Cotización de banda transportadora 24"" x 10 m x 0°. Rodillos CEMA C 5"" @ 35°, tambores de cabeza y cola 12""";27/03/2012 12:00;M;3;100;N;28/03/2012 12:00;29/03/2012 12:00;No se solicita cotizar potencia ni soportes para la banda;;A;
0053;0084;DSC;N;Y;Y;Y;N;N;N;Banda para agregados, 190 tph con altura de salida de 4 m y angulo max de 17°;29/03/2012 12:00;M;5;100;N;30/03/2012 12:00;30/03/2012 12:00;;;A;
0054;0001;DSC;N;Y;N;Y;N;N;N;"Rodillos de carga, impacto y retorno de 4 1-2"" para banda de 24"" @ 35°, con puntas estandar """;04/04/2012 12:00;M;4;100;N;0000-00-00 00:00:00;09/04/2012 12:00;;;A;
0055;0001;JSE;N;N;Y;N;N;N;N;Crear con ayuda del ingeniero Ronald y Mauricio Silva, los parametros generales de creación de materiales para el ERP;04/04/2012 12:00;A;10;100;N;0000-00-00 00:00:00;18/05/2012 12:00;Se hace la entrega de todos los datos referentes al listado maestro de materiales, y concernientes al alcance del departamento de presupuestos.;;A;
0056;0013;DSC;N;Y;N;Y;N;N;N;"Componentes para banda transportadora de 20"" Estación de carga, retorno e impacto de 3 1-2"" x 23"" con eje de 20 mm.""";09/04/2012 12:00;A;4;100;N;11/04/2012 12:00;11/04/2012 12:00;"No disponemos de componenetes para banda transportadora de 20""";;A;
0057;0068;WAV;N;Y;N;N;N;N;N;"Rodillo de impacto de 7"" x 4 1-2"" con eje de 11"" x 1-2"" Rodillo de retorno 56 cm x 4 1-2"" con eje 20 mm x 64 cm""";12/04/2012 12:00;M;3;100;N;0000-00-00 00:00:00;26/04/2012 12:00;;;A;D-3240-12
0058;0003;FAP;N;Y;N;Y;N;N;N;"Estaciones triples de carga para bandas de 30"", 24"" y 20"" @ 35°""";16/04/2012 12:00;A;3;100;N;16/04/2012 12:00;16/04/2012 12:00;;;A;D-3222-12
0059;0006;FAP;N;Y;N;Y;N;N;N;"Estaciones de carga 4 1-2"" x 290 x 330 (Cant. 60) y estaciones de retorno 4 1-2"" x 860 x 1200 (Cant. 12)""";17/04/2012 12:00;A;3;100;N;17/04/2012 12:00;17/04/2012 12:00;;;A;
0060;0057;WAV;N;Y;Y;Y;N;N;N;"Banda transportadora de 24"" x 7.2 m @ 0°,banda de 390mm x 5 m @ 2,4 m (descarga) y banda de 710 mm x 5.5 m @ 1.4 m""";17/04/2012 12:00;M;6;10;N;18/04/2012 12:00;18/04/2012 12:00;Esperar confirmación por Fredi para cotizar, el cliente es de medellin.;;A;
0061;0039;FAP;Y;N;N;N;N;N;N;creación de OT para 2 tornillos sin fin iguales a los referenciados en la OT-1447;19/04/2012 12:00;A;2;100;Y;19/04/2012 12:00;19/04/2012 12:00;Se debe enviar la factura al correo  facesas.zs@gmail.com Ant. Florinda;;A;D-3224-12
0062;0065;DSC;N;Y;N;Y;N;N;N;"Tornillo transportador de 12"" x 1200 mm paso de 10"" y punta de eje de potencia de 1 1-2""";19/04/2012 12:00;A;3;10;N;20/04/2012 12:00;22/04/2012 12:00;Se vence el tiempo de cotización.;;C;
0063;0054;JSE;N;Y;Y;Y;N;N;N;Cama de rodillos de 38 cm de ancho x 80 cm de largo para manejo de bandejas de 13 kg;19/04/2012 12:00;A;4;10;Y;20/04/2012 12:00;22/04/2012 12:00;"Enviar cotización al correo imjosemolano@yahoo.es El tipo de aplicación no es pertinente al foco de negocio de Dismet S.A.S.""";;C;
0064;0024;FAP;N;Y;N;Y;N;N;N;"Rodillos de acuerdo a lo solicitado por el cliente: 10 limpiantes de retorno, 24 de carga, 33 de impacto, 30 de retorno y 17 estaciones para banda de 24"". 8 lipiantes de retorno, 18 de carga, 12 de impacto, 9 de retorno para banda de 30.""";20/04/2012 12:00;A;5;100;N;21/04/2012 12:00;21/04/2012 12:00;;;A;
0065;0003;FAP;N;Y;Y;Y;N;N;N;"Bandas transportadoras de acuerdo a especificaciones: 30"" x 25 m, 30"" x 23 m, 24"" x 18 m, 24"" x 12 m, 24"" x 15 m, 24"" x 45 m""";23/04/2012 12:00;MA;7;10;N;24/04/2012 12:00;25/04/2012 12:00;El proceso es tomado por Fredy en vista de mi ausencia.;;C;
0066;0044;DSC;N;Y;N;Y;N;N;N;"Rodillos de carga 3"" x 170 mm x 220 mm - Cant. 20. Rodillos de retorno 3"" x 570 mm x 650 mm - Cant. """;23/04/2012 12:00;A;3;100;N;23/04/2012 12:00;23/04/2012 12:00;;;A;
0067;0015;AGM;N;Y;N;Y;N;N;N;Elevador de cangilones en acero inoxidable, ramba de acceso y tolva de alimentación;26/04/2012 12:00;MA;6;100;N;26/04/2012 12:00;26/04/2012 12:00;;;A;D-3244-12
0068;0067;FAP;N;Y;N;Y;N;N;N;"Rodillo de retorno 4 1-2"" x 850 x 890 mm, con cuadrante de 1-2""";27/04/2012 12:00;MA;2;100;N;27/04/2012 12:00;27/04/2012 12:00;;;A;D-3248-12
0069;0071;AGM;Y;Y;N;Y;Y;N;N;Bandas transportadoras, elevadores de cangilones molinos de impacto chutes y estructuras en general de acuerdo a las especificaciones del cliente.;25/04/2012 12:00;MA;9;100;Y;02/05/2012 12:00;02/05/2012 12:00;;;A;D-3259-12
0070;0046;FAP;N;Y;N;Y;N;N;N;"50 rodillos para banda de 24"" de longitud 9 1-2""";02/05/2012 12:00;MA;2;100;N;02/05/2012 12:00;03/05/2012 12:00;;R1;A;D-3410-12
0071;0088;FAP;Y;N;N;N;N;N;N;"Estación de carga 4"" para banda de 24"" Cant. 11. Estación de retorno 4"" con soporte para banda de 24"" Cant. 4.Tambor de Cabeza 12"" encauchetado eje 2"" 1045. Tambor de cola 12"" aspas, eje 2"" 1045 Cant. 1. Tambor de cola 12"" aspas, eje 2"" 1045 Cant. 1.Tensor cantonera, tornillo cincado 1"", par.""";02/05/2012 12:00;MA;3;100;N;02/05/2012 12:00;02/05/2012 12:00;;;A;D-3261-12
0072;0072;FAP;N;Y;Y;Y;N;N;N;"Tornillos de 12"" x 32' Cant. 2""";05/05/2012 12:00;MA;7;100;N;07/05/2012 12:00;11/05/2012 12:00;Tener en cuenta los planos enviados por el cliente.;;A;D-3282-12
0073;0069;DSC;N;Y;Y;Y;N;N;N;"Tornillo para capacidad de 25 tph 8,6 m @ 0º Cant. 1, 70 tph 7,0 m @ 0º Cant. 1, 25 tph 4,4 m @ 0º Cant. 1, 25 tph 4,4 m @ 0º Cant. 1""";25/04/2012 12:00;A;5;15;N;08/05/2012 12:00;27/04/2012 12:00;Se cunple el tiempo maximo de recepción de cotización.;;C;
0074;0071;FAP;N;Y;Y;Y;N;N;N;Actualización de los precios ofertados a Pacific Stone, incluyendo pasarelas;07/05/2012 12:00;MA;7;100;N;09/05/2012 12:00;09/05/2012 12:00;;R3;A;
0075;0002;JSE;Y;Y;N;Y;N;N;N;"Rodillos de 2"" x 800 mm en dostipos: encauchetado y normal.""";09/05/2012 12:00;A;2;100;N;0000-00-00 00:00:00;09/05/2012 12:00;No se oferta encauchetado, pero se propone el uso de cauchos de impacto.;;A;
0076;0073;FAP;N;Y;Y;Y;N;N;N;"Tornillo transportador de 12"" x 14 m para manejo de cascarilla de arroz.""";09/05/2012 12:00;A;4;100;N;0000-00-00 00:00:00;10/05/2012 12:00;;;A;D-3276-12
0077;0071;FAP;Y;Y;N;Y;N;N;N;Revisar el tema a las cubiertas para poder completar adecuadamente la oferta.;12/05/2012 12:00;MA;5;100;N;14/05/2012 12:00;16/05/2012 12:00;Basarse en el presupuesto realizado para P.074;;A;
0078;0075;FAP;Y;N;N;N;Y;N;N;Montaje de placas de impacto para molino MIS-40;14/05/2012 12:00;MA;2;100;Y;14/05/2012 12:00;14/05/2012 12:00;;;A;D-3287-12
0079;0006;FAP;Y;N;N;N;N;N;N;Repuestos para trituradora CT1252;16/05/2012 12:00;MA;2;100;Y;16/05/2012 12:00;16/05/2012 12:00;;;A;OT-1526
0080;0090;JSE;Y;N;N;N;N;N;N;10 estaciones de carga B35-24 y 7 estaciones de retorno CR-24.;16/05/2012 12:00;MA;2;100;Y;16/05/2012 12:00;16/05/2012 12:00;;;A;OT-1527
0081;0030;AGM;N;Y;N;Y;N;N;N;3 Artesas de impacto, 18 Artesas de carga, 5 de retorno, 2 de tambores de cabeza y 2 tambores de cola.;14/05/2012 12:00;MA;5;100;N;16/05/2012 12:00;17/05/2012 12:00;;;A;D-3294-12
0082;0073;FAP;N;Y;Y;Y;N;N;N;"Tornillo transportador de 6"" x 2,5 m ducto de entrada de longitud 1000 mm""";17/05/2012 12:00;M;4;10;N;17/05/2012 12:00;17/05/2012 12:00;El proceso es tomado por Fredy.;;C;
0083;0072;FAP;N;Y;N;Y;N;N;N;"Rodillo de carga 4 1-2"" x 15"", rodillo  de impacto 4 1-2"" x 15"", rodillo de retorno 48"", Todos con puntas hexagonales""";18/05/2012 12:00;B;3;100;N;0000-00-00 00:00:00;18/05/2012 12:00;Se suministran los precios a FAP;;A;
0084;0088;FAP;N;Y;N;Y;N;N;N;"Componentes para banda de 30"" x 20 m. Zaranda de 1,5 x 4,5 m - 2 deck""";18/05/2012 12:00;M;4;100;N;0000-00-00 00:00:00;22/05/2012 12:00;Se envia similar a la cotización realizada con anterioridad.;;A;D-3301-12
0085;0018;JMR;Y;N;Y;N;N;N;N;Calculos de potencia para 12 bandas transportadoras.;18/05/2012 12:00;A;4;100;Y;18/05/2012 12:00;18/05/2012 12:00;Se envian los datos de potencias calculadas al gestor comercial.;;A;
0086;0052;JSE;Y;N;N;N;N;N;N;Enviar información de las zarandas TRIO y las zarandas fabricadas por Dismet, tambien la información requerida para poder realizar una cotización.;23/05/2012 12:00;M;2;100;N;0000-00-00 00:00:00;23/05/2012 12:00;Se envia información a la espera de recibir retroalimentación en los proximos días.;;A;
0087;0027;DSC;N;Y;Y;Y;N;N;N;"Tornillo transportador para dosificación de concreto 20 tph. Longitud 4100 mm Cant. 1, Longitud 6000 mm Cant. 1, Inclinación 17º, diam. 8""";23/05/2012 12:00;A;4;100;N;23/05/2012 12:00;24/05/2012 12:00;"Enviar a correo:alozano@coelingenieria.com, 4073737 - 3166469499""";;A;
0088;0069;FAP;N;Y;Y;Y;N;N;N;"Tonillos con las siguientes caracteristicas: tornillo de 8,6 m - 25 tph cant. 1, tornillo 7,0 m - 70 tph cant. 1, tornillo de 4,4 m - 25 tph cant. 2. Todos con sistema de potencia, acople y trasnmisión.""";23/05/2012 12:00;A;6;100;N;0000-00-00 00:00:00;31/05/2012 12:00;El material a transportar es Harina de crudo, densidad de 0,855 t/m³, granulometria de malla 200 = 75 micras, humedad 1%, abrasivo.;;A;
0089;0040;AGM;N;Y;N;Y;N;N;N;"6 rodillos de retorno 3 1-2"" x 600 mm. 2 tambores 12"" x 600 mm con eje de 80 mm, con manguitos de fijación. 30 estaciones de carga de 4 1-2"" x 7"" @ 30º, 6 estaciones de impacto de las mismas dimensiones.""";23/05/2012 12:00;MA;4;100;N;24/05/2012 12:00;24/05/2012 12:00;;;A;D-3313-12
0090;0006;FAP;N;Y;N;Y;N;N;N;"Banda transportadora 24"" x 6 m rodillos CEMA C de 5"" @ 35º, en canal C de 6""";24/05/2012 12:00;MA;3;100;Y;24/05/2012 12:00;24/05/2012 12:00;;;A;
0091;0072;FAP;Y;Y;N;N;N;N;N;"Cotizar componentes para banda de 42"" Carga, Impacto, Retorno y tambores""";24/05/2012 12:00;MA;4;100;Y;24/05/2012 12:00;24/05/2012 12:00;;;A;D-3310-12
0092;0001;FAP;N;Y;N;Y;N;N;N;"Bandas transportadoras de: 36"" x 20 m cant. 1, 30"" x 20 m cant. 1, 24"" x 18 m cant. 3. Todas fabricadas en canal C de 6""";24/05/2012 12:00;M;5;10;N;25/05/2012 12:00;26/05/2012 12:00;El proceso ;;C;
0093;0009;HAG;Y;Y;N;Y;N;N;N;Bandas transportadoras para planta de trituración.;24/05/2012 12:00;A;6;100;N;25/05/2012 12:00;29/05/2012 12:00;;;A;
0094;0040;JSE;Y;Y;Y;N;N;N;N;"Actualización de precio para tambor ofertado en D-3313-12, aumentando el diametro del eje a 3 1-2""";26/05/2012 12:00;A;3;100;N;26/05/2012 12:00;26/05/2012 12:00;;;A;
0095;0050;FAP;N;Y;N;Y;N;N;N;"Componentes para banda de 20"" @ 35º, 19 estaciones de carga, 8 estaciones de impacto, 12 de estaciones de retorno. Todo en tuberia de 4"" CEMA C""";28/05/2012 12:00;A;3;100;N;28/05/2012 12:00;28/05/2012 12:00;;;A;D-3320-12
0096;0071;FAP;Y;N;N;N;N;N;N;De acuerdo a la cotización enviada por Rexnord, organizar la cottización al respecto.;30/05/2012 12:00;MA;2;100;N;30/05/2012 12:00;30/05/2012 12:00;;;A;
0097;0007;JSE;N;Y;N;Y;N;N;N;"Rodillos de carga e impacto para bandas de 32"" y 38"", de diametro 4""";31/05/2012 12:00;M;2;100;N;01/06/2012 12:00;05/06/2012 12:00;Enviar correo a ventas2@bandasybandasltda.com;;A;D-3340-12
0098;0001;FAP;N;Y;Y;Y;N;N;N;"Tornillo transportador 6"" de diametro""";01/06/2012 12:00;A;3;100;N;01/06/2012 12:00;05/06/2012 12:00;;R1;A;
0099;0077;HAG;N;Y;N;Y;N;N;N;"Bandas transportadoras de las siguientes caracteristicas: 36"" x 10 m - Cant. 1 30"" x 20 m - Cant. 1 30"" x 12 m - Cant. 1 18"" x 18 m - Cant. 3""";02/06/2012 12:00;M;4;100;N;02/06/2012 12:00;02/06/2012 12:00;;;A;
0100;0008;FAP;Y;N;N;N;N;N;N;"Actualizar ofertas para valvulas linatex. Referencias """;01/06/2012 12:00;A;2;100;N;01/06/2012 12:00;01/06/2012 12:00;;;A;D-3333-12
0101;0090;JSE;N;Y;N;Y;N;N;N;"5 estaciones de carga autoalineante para banda de 36""";04/06/2012 12:00;M;2;100;N;0000-00-00 00:00:00;05/06/2012 12:00;"Esta cotización hace parte de una oferta con componentes TRIO para banda de 36"" Estacion de impacto, estación de retorno""";;A;D-3337-12
0102;0075;AGM;Y;N;N;N;N;N;N;"Martillos para molino MIS-40. Precio unitario $ 564.300,00""";04/06/2012 12:00;A;2;100;N;04/06/2012 12:00;05/06/2012 12:00;La gerencia aprueba un descuento del 10% y froma de pago 15 días F.F.;;A;D-3336-16
0103;0059;AGM;Y;Y;N;N;N;N;N;Redactar cotización para componentes de trituradora de acuerdo a cotización guía.;05/06/2012 12:00;MA;3;100;N;05/06/2012 12:00;05/06/2012 12:00;;;A;D-3343-12
0104;0001;FAP;N;Y;N;Y;N;N;N;"Banda transportadora de 24"" x 18 m para el manejo de arena, se deben reemplazar las estaciones de impacto por estaciones de carga. La estructura debe estar hecha en Canal C de 6""";06/06/2012 12:00;M;4;100;N;06/06/2012 12:00;07/06/2012 12:00;;;A;
0105;0001;JMR;Y;N;Y;N;N;N;N;"Cálculo de banda transportadora: 780 m @ 14º, dens 0,8 T-m³, Vel 1,6 a 1,8 m-s, 200 Tph, BW 48""";06/06/2012 12:00;A;3;100;N;06/06/2012 12:00;06/06/2012 12:00;;;A;
0106;0051;DSC;N;Y;Y;Y;N;N;N;Elevador de cangilones en acero inoxidable, para el manejo de Naranja. 4 tph x 11 m de altura;07/06/2012 12:00;A;4;70;N;07/06/2012 12:00;09/06/2012 12:00;;;P;
0107;0014;FAP;Y;N;N;N;N;N;N;Realizar la cotización para el proyecto P.039 ;12/06/2012 12:00;MA;5;100;N;12/06/2012 12:00;13/06/2012 12:00;Se entrega la información solicitada al Ing. David Salamanca.;;A;
0108;0085;JSE;Y;Y;N;N;N;N;N;"Componentes para banda de 30"" 30 estaciones CEMA B de 4""";12/06/2012 12:00;M;3;100;N;13/06/2012 12:00;14/06/2012 12:00;"Enviar al correo tmamutt@gmail.com. Tel: 4276191/92""";;A;D-3321-12
0109;0073;FAP;N;Y;N;Y;N;N;N;"Dos Staker para tornillo transportador de 124 mm de diametro, 3100 mm de longitud, paso de 300 mm, 200 mm de punta coninca, puntas de eje en SAE 1045 1 1-2"" """;13/06/2012 12:00;M;5;100;N;13/06/2012 12:00;13/06/2012 12:00;;;A;D-3353-12
0110;0079;DSC;Y;Y;Y;Y;N;N;N;"Bandas trasnportadoras para el manejo de agregador 2,1 T-m³ 24"" x 48 m @ 0º - Cant. 1 24"" x 60 m @ 0º - Cant. 1""";14/06/2012 12:00;MA;4;100;N;0000-00-00 00:00:00;15/06/2012 12:00;;;A;
0111;0037;AGM;Y;Y;N;N;N;N;N;Equipos y componentes para planta de trituración.;14/06/2012 12:00;MA;4;100;N;0000-00-00 00:00:00;15/06/2012 12:00;;;A;
0112;0079;DSC;Y;N;N;N;N;N;N;Motorreductor 20 HP con salida de 44 rpm;16/06/2012 12:00;M;2;100;Y;16/06/2012 12:00;16/06/2012 12:00;"Esta cotización debe ser agregada al P.110 con base a la recomendación del Ingeniero Alfredo y el valor de potencia dado por el cliente. El costo del motorreductor es entregado a David Salamanca.""";;A;
0113;0005;FAP;N;Y;N;Y;N;N;N;"Rodillos 4 1-2"" x 25 cm x 30 cm - Cant. 9 Rodillos 3 7-16 x 25 cm x 30 cm - Cant. 4 Rodillos 2 6-16"" x 80 cm x 90 cm - Cant. 6 Todos con puntas estandar.""";16/06/2012 12:00;M;3;100;N;16/06/2012 12:00;16/06/2012 12:00;;;A;D-3358-12
0114;0058;FAP;N;Y;N;Y;N;N;N;"Rodillo de carga 3 1-2"" x 240 mm - Cant. 90 Rodillo de retorno 3 1-2"" x 750 mm - Cant. 14""";19/06/2012 12:00;A;2;100;Y;16/06/2012 12:00;16/06/2012 12:00;Adicionalmente se cotizan las artesas para rodillos de carga.;;A;D-3361-12
0115;0001;AGM;Y;N;N;N;N;N;N;"Recopilar información de todos los proyectos realizados para Holcim en los ultimos 2 años. Realizar informe que incluya el valor del contrato, tiempo, referencias, etc.""";20/06/2012 12:00;A;4;70;N;22/06/2012 12:00;26/06/2012 12:00;;;P;
0116;0061;FAP;N;Y;N;Y;N;N;N;"Tornillo transportador de diametro 8"" x 4,5 m 12"" x 8,5 m 10"" x 29,1 m. Con aletas de aire sin nucleo, canales, tapas, rodamientos, ejes y base de instalación del motor.""";22/06/2012 12:00;A;5;10;N;27/06/2012 12:00;26/06/2012 12:00;Es necesario aclarar el tema de las aletas de aire.;;C;
